{
  "$schema": "https://json-schema.org/draft/2020-12/schema",
  "$id": "https://raw.githubusercontent.com/thomasMinh1995/UpgradeLens/main/eval/schemas/golden-case.schema.json",
  "title": "UpgradeLens Golden Evaluation Case",
  "description": "Portable provider-independent golden case for AI Version Analysis evaluation.",
  "type": "object",
  "additionalProperties": false,
  "required": [
    "schemaVersion",
    "id",
    "title",
    "category",
    "repository",
    "dependency",
    "versions",
    "selectedEvidence",
    "expectedResult"
  ],
  "properties": {
    "schemaVersion": { "const": "1.0.0" },
    "id": {
      "type": "string",
      "pattern": "^[a-z0-9][a-z0-9-]*(/[a-z0-9][a-z0-9-]*)+$"
    },
    "title": { "type": "string", "minLength": 1 },
    "category": {
      "enum": [
        "high-risk",
        "medium-risk",
        "low-risk",
        "unknown",
        "declared-constraint",
        "missing-evidence",
        "conflict"
      ]
    },
    "repository": {
      "type": "object",
      "additionalProperties": false,
      "required": ["name", "fixturePath", "ecosystem", "languages"],
      "properties": {
        "name": { "type": "string", "minLength": 1 },
        "fixturePath": {
          "type": "string",
          "minLength": 1,
          "pattern": "^(?!/)(?![A-Za-z]:)(?!.*(?:^|/)\\.\\.(?:/|$))[^\\\\]+$"
        },
        "ecosystem": { "type": "string", "minLength": 1 },
        "packageManager": { "type": ["string", "null"] },
        "languages": {
          "type": "array",
          "minItems": 1,
          "uniqueItems": true,
          "items": { "type": "string", "minLength": 1 }
        }
      }
    },
    "dependency": {
      "type": "object",
      "additionalProperties": false,
      "required": [
        "packageId",
        "declaredName",
        "normalizedName",
        "ecosystem",
        "registry",
        "dependencyType",
        "manifest"
      ],
      "properties": {
        "packageId": { "type": "string", "minLength": 1 },
        "declaredName": { "type": "string", "minLength": 1 },
        "normalizedName": { "type": "string", "minLength": 1 },
        "ecosystem": { "type": "string", "minLength": 1 },
        "registry": { "type": "string", "minLength": 1 },
        "dependencyType": { "type": "string", "minLength": 1 },
        "manifest": {
          "type": "string",
          "minLength": 1,
          "pattern": "^(?!/)(?![A-Za-z]:)(?!.*(?:^|/)\\.\\.(?:/|$))[^\\\\]+$"
        }
      }
    },
    "versions": {
      "type": "object",
      "additionalProperties": false,
      "required": [
        "analysisMode",
        "declaredVersion",
        "currentVersion",
        "targetVersion",
        "targetPolicy",
        "delta"
      ],
      "properties": {
        "analysisMode": { "enum": ["exactBaseline", "declaredConstraint"] },
        "declaredVersion": { "type": ["string", "null"] },
        "currentVersion": { "type": ["string", "null"] },
        "targetVersion": { "type": "string", "minLength": 1 },
        "targetPolicy": { "enum": ["explicit", "registryLatest"] },
        "delta": {
          "type": "object",
          "additionalProperties": false,
          "required": ["direction", "classification"],
          "properties": {
            "direction": { "enum": ["upgrade", "same", "downgrade", "unknown"] },
            "classification": { "enum": ["major", "minor", "patch", "prerelease", "other", "unknown"] }
          }
        }
      }
    },
    "selectedEvidence": {
      "type": "array",
      "items": { "$ref": "#/$defs/evidence" }
    },
    "expectedResult": {
      "$ref": "https://raw.githubusercontent.com/thomasMinh1995/UpgradeLens/main/eval/schemas/expected-result.schema.json"
    },
    "notes": { "type": "string" }
  },
  "$defs": {
    "digest": {
      "type": "string",
      "pattern": "^sha256:[a-f0-9]{64}$"
    },
    "httpsUrl": {
      "type": "string",
      "format": "uri",
      "pattern": "^https://(?![^/?#]*@)"
    },
    "evidence": {
      "type": "object",
      "additionalProperties": false,
      "required": [
        "id",
        "kind",
        "sourceId",
        "sourceUrl",
        "authority",
        "trust",
        "contentDigest",
        "locator",
        "releaseVersions",
        "content"
      ],
      "properties": {
        "id": { "$ref": "#/$defs/digest" },
        "kind": {
          "enum": [
            "breakingChanges",
            "changelog",
            "compatibility",
            "deprecations",
            "migrationGuide",
            "registryFact",
            "releaseNotes"
          ]
        },
        "sourceId": { "type": "string", "minLength": 1 },
        "sourceUrl": { "$ref": "#/$defs/httpsUrl" },
        "authority": {
          "enum": ["registryAuthoritative", "officialProject", "publisherProvided", "community"]
        },
        "trust": { "enum": ["official", "publisher", "verified", "community", "unknown"] },
        "contentDigest": { "$ref": "#/$defs/digest" },
        "locator": { "type": "string", "minLength": 1 },
        "releaseVersions": {
          "type": "array",
          "uniqueItems": true,
          "items": { "type": "string", "minLength": 1 }
        },
        "content": { "type": "string", "minLength": 1 },
        "conflictsWith": {
          "type": "array",
          "uniqueItems": true,
          "items": { "$ref": "#/$defs/digest" }
        }
      }
    }
  }
}
